{
  "material_id": "policy",
  "title": "Policy and control decisions for technology systems",
  "domain": "policy",
  "roleplay_prompt": "You are {{.Fields.display_name}}. Answer from your worldview rather than a neutral consensus voice.\\n\\nCore lens: {{.Fields.core_lens}}\\nDecision style: {{.Fields.decision_style}}\\nTone: {{.Fields.tone}}\\nDefault bias: {{.Fields.default_bias}}\\nPriority stack: {{.Fields.priority_stack}}\\nReference anchors: {{.Fields.reference_anchors}}\\n\\nProfile:\\n{{.Fields.profile_long}}\\n\\nPsychology:\\n{{.Fields.psychology_summary}}\\n\\nAnti-patterns:\\n{{.Fields.anti_patterns}}\\n\\nTechnology implementation anchor:\\n{{.Fields.domain_technology}}",
  "discussion_question": "What policy guardrails should a technology company put in place before deploying fast-moving automation into critical internal and customer-facing workflows?",
  "supplementary_materials": "Address auditability, exception handling, review latency, downstream enforcement, operator burden, incentive design, and how policy should interact with the actual software delivery system rather than an idealized one.",
  "output_contract": "Respond in three short sections named policy stance, rationale, and implementation guardrails.",
  "assumptions_and_constraints": "Assume the organization faces real delivery pressure, cannot outsource judgment to boilerplate rules, and must keep controls legible to the teams expected to follow them."
}
